{
  "schemaVersion": "1.0.0",
  "contractVersion": "1",
  "platform": {
    "os": "linux",
    "architecture": "arm64"
  },
  "image": {
    "repository": "ghcr.io/gustavoarielms/multi-sdd-team-codex-app-server",
    "reference": "ghcr.io/gustavoarielms/multi-sdd-team-codex-app-server@sha256:633fbdd34f7760be8d94dae3a1673694b9ff3e70d3a975ccb1c7e6f497ff286f",
    "indexDigest": "sha256:32bb6581847ff87b49339da8c089d8796566a0ab96434057ea388bca912b95e7",
    "platformDigest": "sha256:633fbdd34f7760be8d94dae3a1673694b9ff3e70d3a975ccb1c7e6f497ff286f",
    "configDigest": "sha256:21020eeec646f4ebb8cf16eb118a7c10a874bf1f9c334c4598008ec44769e2dd"
  },
  "base": {
    "distribution": "debian",
    "version": "13.6",
    "reference": "debian@sha256:d7e12182ce18b85b93007c1dedf31f2d29e01ccf3182cc4017c709b6259bc132",
    "indexDigest": "sha256:d7e12182ce18b85b93007c1dedf31f2d29e01ccf3182cc4017c709b6259bc132",
    "platformDigest": "sha256:7215f78f35ffe58fe13f244fac9c4f21326d55187271fbb3e1a8aa5cc7e387ab",
    "configDigest": "sha256:7e3898f7b011a107d0ef7393d5f604a6e0c0ff05ac4f2476630a8af21059ec9b"
  },
  "entrypoint": {
    "path": "/usr/local/libexec/sdd-codegraph/runtime-entrypoint",
    "sha256": "sha256:5c87fc27fef983e3a4a6963cd29debe300a4038db5f806356c72d18642ba0026"
  },
  "codex": {
    "version": "0.154.0",
    "source": "https://github.com/openai/codex/releases/download/rust-v0.154.0/codex-app-server-package-aarch64-unknown-linux-musl.tar.gz",
    "archiveSha256": "sha256:295bb1b94a8b964b2d2461db9736b9907a9e4daa6ceb8e9bbb820b304fa897ed",
    "binaryPath": "/opt/openai/codex-app-server/bin/codex-app-server",
    "binarySha256": "sha256:0c2495cedd0e01fd6ba1e9d949b637f55ac283e6019b998024c010788da8c508"
  },
  "identity": {
    "uid": 10001,
    "gid": 10001
  },
  "rootfsInventorySha256": "sha256:cc426d5039659c6cb1ed7a38bd749238aa50038bbdb2d0fc1c21787d2395d4fd"
}
